{
  "title": "A teaching edition of Query-Dependent Weighted Memory: A Minimal Algebraic Model (fictional source)",
  "learning_outcomes": [
    {
      "id": "understand_problem",
      "level": "understand",
      "description": "Explain why uniform averaging cannot respond to a changed query when the stored values stay fixed."
    },
    {
      "id": "understand_mechanism",
      "level": "understand",
      "description": "Distinguish the roles of query, keys, scores, weights, and values in the proposed reader."
    },
    {
      "id": "apply_weighted_sum",
      "level": "apply",
      "description": "Calculate a small weighted sum and identify the equal-score case as the ordinary mean."
    },
    {
      "id": "analyze_dependencies",
      "level": "analyze",
      "description": "Trace which quantities can change when the query, keys, or values change."
    },
    {
      "id": "analyze_evidence",
      "level": "analyze",
      "description": "Separate the paper's algebraic consequences from empirical claims that its evidence does not support."
    }
  ],
  "sections": [
    {
      "id": "prerequisite_tools",
      "title": "Before the paper: vectors and weighted sums",
      "kind": "prerequisites",
      "parent_id": null,
      "paper_explanation": "This teaching section supplies background rather than reporting a section of the fictional paper. A vector is an ordered list of numbers; its width is its number of entries. A dot product multiplies corresponding entries of two equally wide vectors and adds those products, producing one scalar. A weighted sum multiplies each value vector by one coefficient and adds corresponding coordinates. If the coefficients sum to one and are nonnegative, the result is an average that may favor some values more than others.",
      "simple_explanation": "Separate two tasks: deciding how much each record contributes, then combining its contents. For scalar contents 2 and 8, equal coefficients 0.5 and 0.5 give 5. Coefficients 0.25 and 0.75 give 6.5. These numbers are a supplied teaching example, not a result reported by the paper.",
      "intuition": {
        "explanation": "A weighted average keeps the idea of averaging while allowing unequal shares. The shares explain the arithmetic contribution of each supplied value.",
        "basis": "background",
        "source_refs": []
      },
      "connections": [
        {
          "topic": "Weighted averages",
          "section_id": "proposed_reader",
          "explanation": "This general mathematical operation is the final stage of the paper's reader.",
          "basis": "background",
          "source_refs": []
        }
      ],
      "learning_outcome_ids": [
        "understand_mechanism",
        "apply_weighted_sum"
      ],
      "visual_ids": [],
      "source_refs": [],
      "boundaries": [
        {
          "kind": "simplification",
          "description": "The two-number example introduces the arithmetic only; the paper's value rows may contain several coordinates.",
          "basis": "background",
          "source_refs": []
        }
      ]
    },
    {
      "id": "paper_introduction",
      "title": "The paper's question: can a memory read depend on the request?",
      "kind": "introduction",
      "parent_id": null,
      "paper_explanation": "The fictional paper considers a memory made of paired keys and values. A query represents a current request, a key provides a record's matching representation, and a value holds the information that will be combined. The paper asks for a transparent rule whose output can depend on the query. It does not describe how these representations are learned. Its stated contribution is a small mathematical definition together with consequences that can be inspected directly.",
      "simple_explanation": "The same collection can be read differently for different requests. The paper separates the information used to match a record from the information returned by that record. This separation is central to the later explanation of why changing values does not change the weights.",
      "intuition": {
        "explanation": "As a teaching analogy, imagine notes with labels and contents. A request is compared with the labels to allocate attention, after which the contents are combined. Real labels and human relevance judgments are not part of the mathematical model.",
        "basis": "analogy",
        "source_refs": []
      },
      "connections": [
        {
          "topic": "Query-independent reading",
          "section_id": "averaging_problem",
          "explanation": "The problem section makes the motivation concrete by considering a reader that ignores the query.",
          "basis": "source_supported",
          "source_refs": [
            "s_problem"
          ]
        }
      ],
      "learning_outcome_ids": [
        "understand_problem",
        "understand_mechanism"
      ],
      "visual_ids": [],
      "source_refs": [
        "s_intro"
      ],
      "boundaries": [
        {
          "kind": "assumption",
          "description": "The query, keys, and values are given inputs. Their construction or learning is outside this paper.",
          "basis": "source_supported",
          "source_refs": [
            "s_intro",
            "s_limits"
          ]
        }
      ]
    },
    {
      "id": "averaging_problem",
      "title": "The problem with always taking the same mean",
      "kind": "problem",
      "parent_id": null,
      "paper_explanation": "The baseline reader adds the stored value rows and divides by their number. Its coefficients are always equal, so the query has no place in the calculation. With scalar values 2 and 8 it always returns 5. Changing only the query cannot change this baseline output. The paper identifies that invariance as a limitation when the intended readout should depend on the request; it does not claim that equal averaging is universally inappropriate.",
      "simple_explanation": "The issue is not that the mean is mathematically wrong. It answers a fixed question: what is the average of all stored values? The proposed method is intended to answer a different kind of question, where the coefficients depend on the current query.",
      "intuition": null,
      "connections": [
        {
          "topic": "A query-dependent alternative",
          "section_id": "proposed_reader",
          "explanation": "The proposed reader changes how coefficients are determined while retaining a weighted-sum readout.",
          "basis": "source_supported",
          "source_refs": [
            "s_method"
          ]
        },
        {
          "topic": "Equal-score behavior",
          "section_id": "algebraic_observations",
          "explanation": "The original mean reappears as a special case when every record receives the same score.",
          "basis": "source_supported",
          "source_refs": [
            "s_observations"
          ]
        }
      ],
      "learning_outcome_ids": [
        "understand_problem",
        "analyze_dependencies"
      ],
      "visual_ids": [],
      "source_refs": [
        "s_problem"
      ],
      "boundaries": [
        {
          "kind": "limitation",
          "description": "Uniform averaging can be suitable when equal contributions are intended; the paper supplies no empirical evidence that replacing it improves a task.",
          "basis": "source_supported",
          "source_refs": [
            "s_problem",
            "s_limits"
          ]
        }
      ]
    },
    {
      "id": "proposed_reader",
      "title": "The proposed solution: compare, normalize, combine",
      "kind": "method",
      "parent_id": null,
      "paper_explanation": "The reader has three ordered stages. First, the dot product between the query and each key gives a compatibility score, divided by the square root of their shared width. Second, softmax exponentiates these scores and divides each result by their total. Third, the resulting coefficient for each record multiplies that record's value row; the weighted rows are added. The query and keys determine the coefficients, while the values determine what those coefficients combine. Key width and value width have separate roles and need not be equal.",
      "simple_explanation": "A key is used for comparison; its corresponding value supplies content. A high score produces a larger share than a lower score, but it does not automatically select one record exclusively. All supplied records participate in this unmasked definition. The source's scaling factor is part of the definition; this small paper provides no experiment that evaluates its usefulness.",
      "intuition": null,
      "connections": [
        {
          "topic": "Vector and weighted-sum background",
          "section_id": "prerequisite_tools",
          "explanation": "The method composes dot products, scalar normalization, and a weighted sum.",
          "basis": "background",
          "source_refs": []
        },
        {
          "topic": "Consequences of the formula",
          "section_id": "algebraic_observations",
          "explanation": "Once the equations are explicit, equal-score and value-change behavior follow without a benchmark experiment.",
          "basis": "derived",
          "source_refs": [
            "s_formula",
            "s_observations"
          ]
        }
      ],
      "learning_outcome_ids": [
        "understand_mechanism",
        "apply_weighted_sum",
        "analyze_dependencies"
      ],
      "visual_ids": [
        "v1"
      ],
      "source_refs": [
        "s_method",
        "s_formula"
      ],
      "boundaries": [
        {
          "kind": "assumption",
          "description": "Every query and key has the same positive width, and keys and values have matching row counts.",
          "basis": "source_supported",
          "source_refs": [
            "s_method",
            "s_formula"
          ]